Unnamed: 0,id_hourse,Addresse,Titre,Prix,Surface,Nb_piece,Nb_chambre,Parking,Jardin,Ascenseur,Terrasse,Garage,Prix_sur,Reference,Date_publication,Date_modification,Titre_description,Description
163,YV78_167,Rambouillet 78120 (Groussay - Providence - Gommerie - Vernes - Dreyfus),"Viager occupé - F74 ans - RAMBOUILLET (78120). Age : Femme de 74 ans
Bouquet : 64700 EUR
Rente : 109 EUR/mois
Prix d'achat : 69580 EUR
Nous vous rappelons qu'en Viager occupé le vendeur reste chez lui, vous ne pouvez y habiter.
En Viager occupé, Le vendeur continue à vivre dans son logement sans changer ses habitudes jusqu'à son départ en maison de retraite ou son décès. Pour l'investisseur, l'acquisition d'un viager occupé s'apparente à un investissement locatif sécurisé, avec un seul occupant (le vendeur), et pour lequel il reçoit la totalité des « loyers » au moment de l'acquisition sous forme de décote d'occupation (DUH)
Descriptif du bien : A 5 minutes de MAINTENON (gare SNCF, tous commerces)
10 minutes d'EPERNON (gare SNCF, tous commerces)
30 minutes de CHARTRES (gare SNCF, tous commerces)
30 minutes de RAMBOUILLET (gare SNCF, forêt domaniale, tous commerces)
Idéale pour un investisseur, maison de village sur 2 niveaux comprenant au rez-de-chaussée : cuisine, salon séjour avec cheminée ouverte et poutres.
A l'étage : palier, 2 chambres, salle de bains, WC.
Grenier. Chauffage électrique basse consommation. Fibre optique. Assainissement tout-à-l'égout.
Dépendances : Préau, atelier, étable, pigeonnier. Belle cave voûtée.
Le tout sur un charmant terrain clos de murs de 449 m².
Excellent investissement dans un secteur prisé, ou future résidence, vous réaliserez avant tout un placement sécurisé et à très forte rentabilité.
Analyse financière : VIAGER OCCUPÉ.
Vous achetez ce bien sur la base d'une valeur occupée de 69 580 EUR en versant un apport de 64 700 EUR FAI (frais d'agence inclus) à la signature de l'acte authentique chez le notaire et une mensualité de 109 EUR sur la durée.
Charmante maison mitoyenne d'un seul côté, dans un village
en limite de l'EURE-ET-LOIR et des YVELINES, située à 1 H 30 de PARIS par la route et à 5 minutes de la Gare de MAINTENON ligne Paris Montparnasse - Brest.
A partir de PARIS ou du MANS, l'accès au village se fait, via l'autoroute A 11 «L'Atlantique» sortie ABLIS (sens Paris Province) ou CHARTRES Est (sens Province-PARIS) et la RN 10, via GALLARDON. Par voie ferroviaire, descendre en gare de MAINTENON (4 kms), située sur la ligne PARIS Montparnasse-LE MANS.
Le village dispose d'une école et d'une salle polyvalente, les commerces sont à 5 minutes en voiture.
N'attendez-plus, ce bien est pour vous !",64 700 €,84 m²,4 pièces,2 chambres,,Jardin,,,,Rente : 109 €/mois,Réf. de l’annonce : 421828001,Publiée il y a plus de 2 mois,Modifiée le 3 nov. 2020,"Achat maison 4 pièces 84 m², Rambouillet - 64 700 €",Descriptif de cette maison à vendre de 4 pièces et 84 m²
164,YV78_168,Magny-les-Hameaux 78114,"A proximité du musée de Port Royal, surplombant un magnifique terrain arboré de 3 hectares, cette ravissante maison de 260m2 et datant du 17 siècle vous propose, un grand salon avec une cheminée (insert), un petit salon et un bureau en mezzanine, une belle salle à manger avec sa cheminée d'époque et une très belle hauteur sous plafond ayant un accès direct sur la terrasse et la piscine.
A l'étage une suite parentale avec sa salle de bain et son dressing ainsi qu'une autre chambre.
Au 2éme étage, deux autres chambres avec de nombreux rangement et une salle d'eau.
En rez de jardin, une salle de billard, un sauna et un jacuzzi et une salle d'eau.
Attenant à la maison un appartement pour les invités comprenant un séjour, deux chambres et une salle de bain ainsi qu'un studio avec kitchenette et salle d'eau.
Idéal pour une famille ou en tant que résidence secondaire.
Prix vente : 950 000 € honoraires à la charge du vendeur. 
barème d'honoraires : Voir les barèmes des honoraires Contact : Isabelle Mc Williams Voir le téléphone Isabelle MCWILLIAMS Voir le téléphone Voir les barèmes des honoraires",880 000 €,330 m²,13 pièces,5 chambres,,,,,,2 667 €/m²,Réf. de l’annonce : 20781,Publiée il y a plus de 2 mois,Modifiée le 13 oct. 2020,"Achat maison 13 pièces 330 m², Magny-les-Hameaux - 880 000 €",Descriptif de cette maison à vendre de 13 pièces et 330 m²
165,YV78_169,Voisins-le-Bretonneux 78960,"MAISON 5 PIECES 113 M² VOISINS LE BRETONNEUX!

Venez découvrir cette superbe maison située dans un environnement recherché et prisé pour son calme et son accessibilité à toutes les commodités.

Entièrement rénovée avec des matériaux de qualité et de manière contemporaine elle comprend au rez-de-chaussée, une entrée donnant sur une pièce de vie baignée de lumière de plus de 51 m² comprenant séjour, salle à manger et cuisine us aménagée et équipée; un wc séparé et l'accés au garage attenant de plus de 18 m². A l'étage vous bénéficierez de 3 chambres de 10 m², 12 m² et 16 m² dont deux avec placards intégrés; un dressing, une salle de bain, un wc séparé.

Un grenier au premier étage ainsi que des combles aménageables complètent le bien.",560 000 €,113 m²,5 pièces,3 chambres,1 parking extérieur,Jardin,,1 terrasse,1 garage,4 770 €/m²,Réf. de l’annonce : 33290910,Publiée le 8 déc. 2020,Modifiée le 9 déc. 2020,"Achat maison 5 pièces 113 m², Voisins-le-Bretonneux - 560 000 €",Descriptif de cette maison à vendre de 5 pièces et 113 m²
166,YV78_170,Noisy-le-Roi 78590,"Exclusivité - Maison individuelle de 5 chambres sous-sol total. Dans le centre ville de Noisy le roi, à deux pas des commerces, des écoles et de la forêt domaniale de Marly, maison en excellent état de 1980 sur 3 niveaux.

Au rez-de-jardin vous trouverez une entrée avec placards, un salon/salle à manger traversant avec cheminée de 50m2, ouvert sur le jardin par une grande baie vitrée, une cuisine, un office/buanderie, 2 très grandes chambres dont une suite parentale avec dressing, salle-de-douches et toilettes et un toilette indépendant.

Au 1er étage, 3 grandes chambres avec placards, une salle-de-douches, une salle-de-bains, un toilette indépendant.

Au sous-sol, un double garage de 50m2, une chaufferie, une cave et un studio/atelier de 50m2 avec accès extérieur.

Alarme, gestion automatisée du chauffage, volets électriques à commande centralisée et différenciée.",1 095 000 €,205 m²,7 pièces,5 chambres,,,,,,5 341 €/m²,,Publiée le 8 déc. 2020,Modifiée le 9 déc. 2020,"Achat maison 7 pièces 205 m², Noisy-le-Roi - 1 095 000 €",Descriptif de cette maison à vendre de 7 pièces et 205 m²
167,YV78_171,Carrières-sur-Seine 78420 (Centre historique),"CARRIERES SUR SEINE Villa avec vue sur la défense 6 chambres. AFR immobilier vous propose, une villa d'environ 260m² sans mitoyenneté au calme, située sur un terrain de 1121m² piscinable, dans un écrin de verdure sur les coteaux de la Seine, avec vue dégagée sur La Défense et la Tour Eiffel. Elle comprend, au rez de chaussée: une entrée, une cuisine équipée dinatoire, séjour sur terrasse et jardin, salle à manger avec cheminée, wc, buanderie, chaufferie, et garage. A l'étage : 3 chambres, dont 2 sur terrasse avec jacuzzi et vue Paris, et une suite parentale avec un grand dressing, une salle de bains avec douche, wc, combles aménagés en palier avec coin télé, 3 chambres, wc, rangements, salle de bains. Le jardin fait le tour de la maison, et peut recevoir une piscine à débordement face à la vue exposée sud ... Superbe maison de 260m² environ rénovée et agrandie en 2006, avec 6 vraies chambres tout en conservant un grand séjour-salle à manger. Rare à la vente, située limite Chatou. Visite virtuelle disponible sur demande ou sur KLAPTY et visite vidéo sur la chaine YouTube d'AFR Immobilier.
Copropriété de 4 lots (Pas de procédure en cours).
Charges annuelles : 200.00 euros.",1 495 000 €,260 m²,9 pièces,6 chambres,2 places de parking,Jardin,,,,5 750 €/m²,Réf. de l’annonce : CAR4766,Publiée le 8 déc. 2020,Modifiée le 9 déc. 2020,"Achat maison 9 pièces 260 m², Carrières-sur-Seine - 1 495 000 €",Descriptif de cette maison à vendre de 9 pièces et 260 m²
168,YV78_172,Montigny-le-Bretonneux 78180,"PLAN DE L'EGLISE !! EN IMPASSE !! MAISON INDIVIDUELLE !!!! PLUS DE 900M² DE PARCELLE !!

Cette belle maison vous offrira une belle et chaleureuse entrée, un très grand séjour de plus de 40m² traversant donc LUMINEUX. 

A l'étage: 4 belles chambres dont une très grande suite parentale. 

Ecoles, commerces, transports,.... A PIED !!

NE TARDER PAS !!",750 000 €,176 m²,6 pièces,4 chambres,2 parkings extérieurs,Jardin,,,2 garages,4 148 €/m²,Réf. de l’annonce : 33046309,Publiée le 5 déc. 2020,Modifiée le 6 déc. 2020,"Achat maison 6 pièces 176 m², Montigny-le-Bretonneux - 750 000 €",Descriptif de cette maison à vendre de 6 pièces et 176 m²
169,YV78_173,Houdan 78550,"HOUDAN 78950- Maison traditionnelle et familiale - 4 chambres - bureau - séjour double - garage - terrain1027m². EN EXCLUSIVITE Proche HOUDAN 78550 avec proximité des écoles , commerces et gare, Sandrine CAILLAUD vous propose cette belle et spacieuse maison familiale d'environ 165m², de construction traditionnelle !
Un bel espace de vie vous accueille au rez-de-chaussée avec hall cathédrale ouvert sur séjour double et salle à manger, cuisine aménagée et équipée, office, 1 chambre avec salle de bains, WC.
A l'étage: mezzanine, 3 belles chambres dont une suite parentale avec dressing et salle de douche, 2ème salle de douche, WC, et grand bureau-bibliothèque avec espace lingerie.
Garage attenant d'environ 25m²
Cheminée insert.
Double vitrage et volets roulants.
L'ensemble sur un terrain de 1027m² , agrémenté d'une grande terrasse , d'un abris bois et cabanon.
TOUT, vous avez absolument tout pour être heureux en famille
dans cette maison de qualité très bien située !
Rare à la vente .
Pour en voir plus, VISITE VIRTUELLE SUR DEMANDE !
Pour visiter et vous accompagner dans votre projet contactez Sandrine CAILLAUD au Voir le téléphone ou par courriel à Contacter 
Cette présente annonce a été rédigée sous la responsabilité éditoriale de Sandrine CAILLAUD agissant sous le statut d'agent commercial, RSAC numéro 795093582 RCPro GALLIAN 127 100 479
Mandat n°252819CLS - Le professionnel garantit et sécurise votre projet immobilier.
SAS PROPRIETES PRIVEES - ZAC du chêne ferré - 44 allée des 5 continents 44120 VERTOU - Carte professionnelle CPI 44012016 000 010 388 CCI Nantes-Saint-Nazaire.
Prix de vente: 426000 euros HAI (honoraires inclus de 16345 euros à la charge de l'acquéreur soit 3.99% soit 409655 Euros hors honoraires) dont 3.99 % honoraires TTC à la charge de l'acquéreur.",426 000 €,165 m²,7 pièces,4 chambres,,Jardin,,,,2 483 €/m²,,Publiée le 5 déc. 2020,Réf. de l’annonce : 252819CLS,"Achat maison 7 pièces 165 m², Houdan - 426 000 €",Descriptif de cette maison à vendre de 7 pièces et 165 m²
170,YV78_174,Villiers-Saint-Frédéric 78640,"Maison individuelle sur sous-sol total et 807m2 de terrain. VISITE 3D IMMERSIVE DISPONIBLE ! EXCLUSIVITÉ MIEZIMMO... Dans le charmant village de Neauphle le vieux, à 5 minutes de Villiers ! Maison édifiée sur 807m2 de jardin arboré et sous-sol total. Elle propose au rez-de-chaussée : entrée, dégagement, séjour double avec salle à manger, cuisine dinatoire équipée, WC, chambre, salle de bain et buanderie. A l'étage : dégagement desservant 3 chambres dont une permettant l'accès à une 4ème chambre à aménager. Sous-sol total avec buanderie/chaufferie, cave, cellier, dégagement et garage. Jardin arboré sans vis-à-vis, terrasse et 2 ateliers en dépendance. Ecoles, commerces et gare à 5 minutes ! Installez-vous !",459 000 €,147 m²,7 pièces,5 chambres,2 places de parking,Jardin,,Terrasse,,2 993 €/m²,,Publiée le 5 déc. 2020,Réf. de l’annonce : 1771B,"Achat maison 7 pièces 147 m², Villiers-Saint-Frédéric - 459 000 €",Descriptif de cette maison à vendre de 7 pièces et 147 m²
171,YV78_175,Houilles 78800 (La Main de Fer),"Maison de 1930 de 149 m2 quartier Main de Fer sur 288 m2. A 15 minutes à pied de la gare, quartier Main de Fer, charme d'Antan et prestations actuelles s'unissent pour vous séduire!
Cette maison se compose d'une entrée, d'un vaste séjour lumineux avec plafond cathédrale , cuisine américaine équipée, et WC séparé avec lave main, deux grandes chambres qui ont gardé leur authenticité ainsi qu'une salle de bains. A l'étage, une mezzanine aménagée en bureau( idéal pour le télétravail!) , 3 chambres spacieuses, WC séparé et salle d'eau. Le tout édifié sur un sous sol partiel et d'un terrain de 288 m2. Belle surprise, une dépendance de 20 m2!
Petits et grands seront ravis pour faire de cette demeure, votre futur havre de paix! Vous en reviez, Weelodge l'a fait! Visite virtuelle disponible....",730 000 €,149 m²,6 pièces,4 chambres,,Jardin,,Terrasse,,4 899 €/m²,,Publiée le 4 déc. 2020,Réf. de l’annonce : 300050-4478963,"Achat maison 6 pièces 149 m², Houilles - 730 000 €",Descriptif de cette maison à vendre de 6 pièces et 149 m²
172,YV78_176,Conflans-Sainte-Honorine 78700 (Chennevières),"Pavillon Individuel. Située en plein CENTRE VILLE de Chennevières mais à l'abri de son agitation, cette charmante maison des ANNEES 30 ne pourra pas vous laisser indifférent! Edifiée sur 507m² de terrain CLOS et parfaitement entretenue, elle se compose au rez-de-chaussée d'une vaste entrée desservant un séjour de 30m² donnant accès à la TERRASSE, d'une grande cuisine dinatoire et d'une buanderie. Au premier niveau se trouvent 3 GRANDES chambres, une bureau (ou chambre bébé) pourvu de NOMBREUX RANGEMENTS et une salle de bain. Au second niveau deux autres chambres et greniers de rangement. Pour compléter ces nombreuses prestations, un garage DOUBLE, une dépendance et un cave partielle !!! Venez vite la découvrir car je ne vous ai pas tout dit",559 000 €,150 m²,8 pièces,5 chambres,2 places de parking,Jardin,,Terrasse,,3 727 €/m²,,Publiée le 3 déc. 2020,Réf. de l’annonce : 134454-3-4572054,"Achat maison 8 pièces 150 m², Conflans-Sainte-Honorine - 559 000 €",Descriptif de cette maison à vendre de 8 pièces et 150 m²
173,YV78_177,Sartrouville 78500 (Les Dix Arpents),"SARTROUVILLE DIX ARPENTS. Pavillon d'environ 80m². Sartrouville DIX ARPENTS. Situé à 8 min à pied de la gare et à deux pas des commerces tous commerces , ce magnifique pavillon de plain pieds comprenant au rez-de-chaussée une pièce à vivre de 30 m2 très lumineuse avec cuisine américaine équipée, un bureau / chambre d'appoint avec placard, une SDE avec WC et une chambre avec dressing vous séduira par ses volumes et son parfait état. Le tout sur sous-sol total aménagé avec une chambre de plus de 14 m2, une pièce d'appoint avec placard, une buanderie, SDE et un garage de 17m2.. Le tout en parfait état et sur une une parcelle d''environ126 m2 avec une terrasse exposée Sud Ouest. . Visite virtuelle disponible : Voir la visite virtuelle .",435 000 €,"80,83 m²",6 pièces,3 chambres,2 places de parking,Jardin,,,,5 382 €/m²,Réf. de l’annonce : 007073E1S5MI,Publiée le 3 déc. 2020,Modifiée le 8 déc. 2020,"Achat maison 6 pièces 81 m², Sartrouville - 435 000 €",Descriptif de cette maison à vendre de 6 pièces et 81 m²
174,YV78_178,Le Mesnil-le-Roi 78600,"Maison de famille de 223 m² - Terrain de 434,00 m². Propriété de famille à 15 mn du Centre de Saint Germain en Laye en bus direct, Maison ancienne avec restauration avant 2000, grande maison 223 m² habitable - 268 m² au sol - 5 chambres, 6 possibles. Vaste Rez de Chaussée traversant orienté Sud Est et Ouest sur ses 2 terrasses - Double Séjour Salon bibliothèque cheminée - Salle à manger avec cheminée insert - 83 m2 d'espaces de vie - grande Entrée - Cuisine ouverte - Petit bureau. Pierres et construction traditionnelle.
Au 1er étage, 3 chambres dont une suite parentale avec sa salle de bains et dressing. Au 2e étage, vaste pièce très lumineuse avec salle d'eau, on peut y faire 2 chambres, actuelle grande chambre et bureau ouvert pleine de lumière. Un autre appartement indépendant dans l'aile ancienne au second.
Charme fou des poutres et de la maison, il y fait bon vivre au coin du feu. Le jardin des 2 cotés de la maison traversante.
Dépendance - 1 stationnement intérieur - 1 cave sous la cuisine. Pour une famille avec enfants et petits enfants, un art de vivre l'espace.
Le Mesnil le Roi est une petite ville paisible et patrimoniale, à 5 mn de la forêt de Saint Germain, avec le bus tout près à 15 mn de Saint Germain ou Maisons Laffitte. Les honoraires d'agence sont à la charge de l'acquéreur, soit 4,89% TTC du prix du bien. Réseau Immobilier CAPIFRANCE - Votre agent commercial Caroline MACARDIER Voir le téléphone - Plus d’informations sur le site de CAPIFRANCE (réf.692285)",1 180 000 €,223 m²,8 pièces,5 chambres,1 place de parking,Jardin,,Terrasse,,5 045 €/m²,Réf. de l’annonce : 340935597792,Publiée le 2 déc. 2020,Modifiée le 4 déc. 2020,"Achat maison 8 pièces 223 m², Le Mesnil-le-Roi - 1 180 000 €",Descriptif de cette maison à vendre de 8 pièces et 223 m²
175,YV78_179,Villiers-Saint-Frédéric 78640,"VILLIERS SAINT FREDERIC, MAISON EN PIERRE CENTRE VILLAGE.. 'EXCLUSIVITE MIEZIMMO'... Situation privilégiée pour cette maison ancienne en parfait état donnant sur cour close de murs (motos, voiture), elle vous offre de plain-pied une très belle salle de réception avec espace cuisine aménagée, chambre ou bureau parqueté, superbe salle de douche avec toilette et fenêtre, dégagement et grand espace de rangement en 1/2 niveau. Au 1er étage, vaste palier parqueté, trois chambres parquetées dont une avec salle de douche privative et toilette. En dépendance, une buanderie / cellier de 6 m2. Belle cour close à l'abri des regards (surface totale avec la maison de 135 m2).
Visite virtuelle 3D immersive à votre disposition, n'hésitez pas à vous balader dans la maison.",378 000 €,120 m²,6 pièces,4 chambres,1 place de parking,Jardin,,,,3 150 €/m²,Réf. de l’annonce : 1776,Publiée le 2 déc. 2020,Modifiée le 8 déc. 2020,"Achat maison 6 pièces 120 m², Villiers-Saint-Frédéric - 378 000 €",Descriptif de cette maison à vendre de 6 pièces et 120 m²
176,YV78_180,Le Mesnil-Saint-Denis 78320,"Maison de 7 pièces. Un prix séduisant pour une très belle affaire. 5 CHAMBRES DONT DEUX SUITES PARENTALES (UNE AU RDC) - TRES BEAUX VOLUMES - SOUS SOL TOTAL - La Résidence a le plaisir de vous présenter en EXCLUSIVITE, cette très jolie maison CONTEMPORAINE (2002) FAMILIALE de 165 m2, avec sa magnifique pièce à vivre de 44 m2, extrêmement LUMINEUSE grâce à ses baies vitrées et à son exposition EST/OUEST, donnant sur une très GRANDE terrasse et sur un magnifique jardin clos. Vous apprécierez sa grande cuisine, très fonctionnelle, semi-ouverte sur le salon. Au rez de chaussée une grande suite parentale (=18 m2 environ) vous attend avec sa salle de douche. Wc séparé. A l'étage un grand palier (11m2) dessert 4 très belles chambres dont une suite parentale avec baignoire et douche à balnéo. Une salle de douche. WC. SOUS SOL TOTAL entièrement carrelé où vous trouverez une cuisine d'été (23m2 environ), pièce supplémentaire de 25 m2 carrelée et chauffée pouvant être utilisé en pièce de jeux, salle de télévision...Grand garage (3,2x7,7) avec porte motorisée en PVC. Si tout cet espace ne vous suffisez pas, les COMBLES SONT AMENAGEABLES ! CHAUFFAGE AU GAZ (CHAUDIEREZ FRISQUET DE 2013).TOUTES VOS COMMODITES SE FERONT A PIED : COMMERCES, BUS, ECOLE, COLLEGE. Vous êtes à 10 mn de la gare de La VERRIERE (TRANSILIEN POUR LA DEFENSE ET MONTPARNASSE), 10 mn de Saint Quentin en Yvelines. Une affaire de haute qualité!.",572 250 €,165 m²,7 pièces,5 chambres,,Jardin,,,,3 303 €/m²,Réf. de l’annonce : 381123_0,Publiée le 1 déc. 2020,Modifiée le 6 déc. 2020,"Achat maison 7 pièces 165 m², Le Mesnil-Saint-Denis - 572 250 €",Descriptif de cette maison à vendre de 7 pièces et 165 m²
177,YV78_181,Vaux-sur-Seine 78740,"Dans un écrin boisé et fleuri de 3000 m2, chaleureuse mais. Au milieu de la verdure, cette chaleureuse maison édifiée sur sous-sol total surélevé et aménagé est composée au 1er : d'une entrée, un séjour, une cuisine, 2 chambres, une salle d'eau et au 2ème : 3 chambres et une salle d'eau, chauffage électrique. Garage indépendant 2 voitures. Hangar. Abris de jardin, le tout sur un terrain de 1930 m2. Une petite maison d'amis composée au RDC d'un séjour, une cuisine, une chambre, une salle d'eau sur un terrain de 1070 m2. Classe énergie : E",467 800 €,124 m²,8 pièces,5 chambres,,Jardin,,1 terrasse,,3 773 €/m²,Réf. de l’annonce : 7874,Publiée le 27 nov. 2020,Modifiée le 28 nov. 2020,"Achat maison 8 pièces 124 m², Vaux-sur-Seine - 467 800 €",Descriptif de cette maison à vendre de 8 pièces et 124 m²
178,YV78_182,Hermeray 78125,"HERMERAY : maison T1 46 m2 + combles aménageables en vente - EXCLUSIVITÉ 
En vente : Dans un hameau d'HERMERAY (78125) à 4 min de GAZERAN découvrez cette maison 1 pièce de 46 m². Elle offre une pièce principale : un séjour de 32 m² avec cuisine aménagée auquel s'ajoute une salle de bains. Le bien dispose également d'une cave 
Le terrain de la propriété est de 350 m².
Cette maison est en bon état général. Possibilité d'ouvrir l'étage pour créer un espace d'environ 25 m2 (soit deux chambres).
Un garage est prévu pour stationner votre véhicule. Honoraires à la charge du vendeur. Vous pouvez consulter les barèmes d'honoraires à l'adresse suivante : Voir les barèmes des honoraires",214 000 €,46 m²,1 pièce,2 chambres,2 places de parking,Jardin,,,1 garage,4 652 €/m²,Réf. de l’annonce : TMAI116167AA,Publiée le 3 nov. 2020,Modifiée le 4 nov. 2020,"Achat maison 1 pièce 46 m², Hermeray - 214 000 €",Descriptif de cette maison à vendre de 1 pièce et 46 m²
179,YV78_183,Chavenay 78450,"Au calme, belle maison familiale de 145 m² édifiée sur une parcelle de 500 m² joliment paysagé. Elle vous offre une entrée donnant sur un séjour avec cuisine ouverte aménagée, le tout avec une triple exposition. Un bureau et des toilettes complètent ce niveau. A l'étage un palier dessert 4 chambres dont une traversante, une salle de bains, une salle de douches et des toilettes. En complément, un garage attenant.",650 000 €,145 m²,6 pièces,4 chambres,1 parking extérieur,Jardin de 500 m²,,1 terrasse,1 garage,4 310 €/m²,,Publiée il y a plus de 2 mois,Réf. de l’annonce : 24351328,"Achat maison 6 pièces 145 m², Chavenay - 650 000 €",Descriptif de cette maison à vendre de 6 pièces et 145 m²
180,YV78_184,Magny-les-Hameaux 78114,"MAISON INDIVIDUELLE MAGNY LES HAMEAUX - 7 pièce(s) - 194 m2. Située sur un terrain de 730m², au calme, maison Individuelle d'environ 194m² au sol (185m² carrez) comprenant :
Au RDC : Entrée avec rangement, séjour traversant de 41m² donnant sur une terrasse exposée Sud/Ouest, grande cuisine ouverte, aménagée et équipée, buanderie, chambre 1 avec sa salle de douche et wc séparé.
Au 1er étage : Grand palier (possibilité de bureau), Chambre 2, chambre 3, salle de douche, chambre 4 et chambre 5 donnant toutes les deux sur une salle de bains, et wc séparé.
Sous sol total d'environ 100m² comprenant : Garage motorisé (capacité de 3 voitures), atelier, cave et pièce de stockage.
Jardin clos avec terrasse exposée Sud/Ouest.
Maison récente (2000), en bon état et offrant de beaux volumes.
Proximité : Centre ville (à moins de 10 minutes à pied), écoles, commerces, forêt...
Transport : Bus - Gare RER B de St Rémy les Chevreuse à 4km
Cette annonce immobilière vous est présentée par Mme LEBRUN Chloé, Agent Commercial mandataire en immobilier immatriculé au Registre Spécial des Agents Commerciaux (RSAC) du Tribunal de Commerce de Versailles (n° 819 397 886). Carte professionnelle CPI 91012018000023831, délivrée par la chambre du commerce d'Evry. dont 3.00 % honoraires TTC à la charge de l'acquéreur.",670 000 €,194 m²,7 pièces,5 chambres,3 places de parking,Jardin,,1 terrasse,,3 353 €/m²,Réf. de l’annonce : 509,Publiée le 27 nov. 2020,Modifiée le 2 déc. 2020,"Achat maison 7 pièces 194 m², Magny-les-Hameaux - 670 000 €",Descriptif de cette maison à vendre de 7 pièces et 194 m²
181,YV78_185,Croissy-sur-Seine 78290,"Maison 7p 145m² sur parcelle de 500m². Exclusivité! Au calme proche des écoles, maison non mitoyenne sur une parcelle de 500m². Elle comprend : une entrée donnant accès au salon lumineux avec accès direct au jardin, cuisine séparée avec espace repas possible (accès au jardin), wc, accès au sous-sol et garage, 2 chambres, un bureau, dressing avec point d’eau et SDB. A l’étage, 3 chambres, SDB et wc. Sous sol total et garage double. Beau jardin verdoyant idéalement exposé et sans vis-à-vis. Travaux à prévoir.",945 000 €,145 m²,7 pièces,5 chambres,,Jardin,,,,6 297 €/m²,,Publiée le 26 nov. 2020,Modifiée le 27 nov. 2020,"Achat maison 7 pièces 145 m², Croissy-sur-Seine - 945 000 €",Descriptif de cette maison à vendre de 7 pièces et 145 m²
