Unnamed: 0,id_hourse,Addresse,Titre,Prix,Surface,Nb_piece,Nb_chambre,Parking,Jardin,Ascenseur,Terrasse,Garage,Prix_sur,Reference,Date_publication,Date_modification,Titre_description,Description
557,YV78_561,Les Essarts-le-Roi 78690,"78690 - LES ESSARTS LE ROI - MAISON 158M2 - 6 PIECES - 4 CHA. Les Essarts, le Roi, à 10 mn à pied du collège, idéalement située entre forêt et centre ville, BLB Immobilier a le privilège de vous présenter cette AGRÉABLE maison de 158 m2 ENTIÈREMENT RÉHABILITÉE et repensée sur un terrain de 750 m2. Elle se compose d'un séjour avec sa cuisine ouverte donnant sur une terrasse de 40 m2 et d'un WC séparé. À l'étage, un pallier dessert deux chambres, une salle de bain comprenant une baignoire et une douche, une buanderie et un WC séparé. Au deuxième étage, se trouvent deux autres chambres ainsi qu'une salle de bain. Un garage double de 40 m2 ainsi que 2 cabanons de jardin complètent ce bien. ++Les plus++ : chauffage électrique intelligent, menuiserie alu double vitrage, volet roulant électrique, deux ballons d'eau chaude de 200 L, porte de garage électrique, portail électrique.
** VISITE VIRTUELLE DISPONIBLE** N'hesitez pas à contacter votre agent immobilier Sebastien EPHREM pour effectuer une visite ou pour tous renseignements, disponible pour vous 7J/7 au Voir le téléphone . La présente annonce immobilière a été rédigée sous la responsabilité éditoriale de M. EPHREM Sebastien, RSAC VERSAILLES no 825380413",550 000 €,158 m²,6 pièces,4 chambres,2 places de parking,Jardin,,2 terrasses,,3 363 €/m²,Réf. de l’annonce : B469,Publiée le 17 nov. 2020,Modifiée le 21 nov. 2020,"Achat maison 6 pièces 158 m², Les Essarts-le-Roi - 550 000 €",Descriptif de cette maison à vendre de 6 pièces et 158 m²
558,YV78_562,Viroflay 78220 (Louvre - Gare),"Maison Viroflay 6 pièce(s) 120 m2 terrain 300 m² garage jardin calme 4 chambres séjour double. A vendre en Exclusivité à Viroflay quartier du Louvre, Maison familiale comprenant entrée, séjour double avec salle à manger, cuisine indépendante, quatre chambres, salle de bains, 2 wc, et un sous-sol total avec garage et jardin.",842 000 €,120 m²,6 pièces,4 chambres,1 place de parking,Jardin,,,,7 017 €/m²,Réf. de l’annonce : 2076,Publiée le 17 nov. 2020,Modifiée le 26 nov. 2020,"Achat maison 6 pièces 120 m², Viroflay - 842 000 €",Descriptif de cette maison à vendre de 6 pièces et 120 m²
559,YV78_563,Les Mureaux 78130 (Route de Verneuil - Aérodrome),"Maison Les Mureaux 6 pièces 124 m². Maison indépendante avec dépendance édifiée sur un terrain de 440 m² comprenant, au rez-de-chaussée, une entrée, un grand salon, une salle à manger, une cuisine indépendante, une chambre et un WC ; à l'étage, 5 chambres dont une suite parentale, un salle de bains et un wc.
Au coeur d'un quartier résidentiel, calme et proche des commodités.
À visiter rapidement avec votre Agence L'ADRESSE.",357 000 €,137 m²,6 pièces,5 chambres,,Jardin,,1 terrasse,,2 606 €/m²,Réf. de l’annonce : 20966,Publiée le 16 nov. 2020,Modifiée le 2 déc. 2020,"Achat maison 6 pièces 137 m², Les Mureaux - 357 000 €",Descriptif de cette maison à vendre de 6 pièces et 137 m²
560,YV78_564,Conflans-Sainte-Honorine 78700 (Fin-d'Oise),"Maison Conflans Sainte Honorine 6 pièce(s) 107 m2. AGENCE LAFORET CONFLANS-SAINTE-HONORINE,, ANDREY & MAURECOURT
Quartier Fin d'Oise, à proximité des gares RER A / SNCF. Maison de 120 m² utiles, offrant entrée, séjour double 37 m² accès sur terrasse, cuisine équipée, WC. A l'étage, 4 chambres, Salle de bains, WC, salle d'eau, dressing. Sous-sol total. Garage plus un stationnement extérieur. Double vitrage PVC, Chaudière gaz de 2017, peintures 2019, volets et velux neufs. Beau terrain de 385 m² sans vis à vis. Rare sur le secteur !
dont 5.00 % honoraires TTC à la charge de l'acquéreur.",441 000 €,107 m²,6 pièces,4 chambres,1 place de parking,Jardin,,1 terrasse,,3 925 €/m²,Réf. de l’annonce : 1898,Publiée le 15 nov. 2020,Modifiée le 4 déc. 2020,"Achat maison 6 pièces 107 m², Conflans-Sainte-Honorine - 441 000 €",Descriptif de cette maison à vendre de 6 pièces et 107 m²
561,YV78_565,Rambouillet 78120 (Villeneuve - Hippodrome),"MAISON FAMILIALE avec 5 à 6 chambres et STUDIO de 60M2 INDÉPENDANT. 78120- Rambouillet- À 5 minutes de la gare direction Montparnasse et accès forêt venez découvrir cette demeure familiale implantée sur un terrain de près de 2500m² arboré et sans vis à vis. Son accès direct aux chemins de promenade et son implantation en retrait de la rue vous séduira par son environnement privilégié. Dés l'entrée vous découvrez de beaux volumes et une grande luminosité avec son triple séjour de plus de 80m2 bénéficiant du soleil tout au long de la journée, une cuisine séparée aménagée avec accès au jardin et au sous-sol, enfin une chambre de 22m2 avec sa salle de bain comprenant douche et baignoire. Au premier étage 2 espaces vous attendent: espace enfants avec 2 chambres et une salle de douche, et de l'autre coté un espace parental avec un bureau, un dressing, une salle de douche et une chambre de 28m2. Cet espace privatif pourrait être repensé en chambres enfants afin de créer 5 chambres à l'étage. La visite se poursuit par le sous-sol semi-enterré, une cuisine d'été buanderie, une cave à vin, un garage de 35m2, une salle home cinéma, et un espace de 60m2 environ avec entrée indépendante pouvant convenir à une profession libérale ou revisité en un studio indépendant à aménager (studio de musique, studio à louer, salle de sport pour coach sportif...). En annexe, cabanon de jardin, auvent voitures et pièce attenante à exploiter également. Tout est réuni pour convenir à une grande famille, à un artiste en recherche de grands volumes ou à une profession libérale en recherche de bureaux. VISITE VIRTUELLE À LA DEMANDE
Ce bien vous est proposé au prix de 895 000euros honoraires TTC inclus à la charge de l'acquéreur: dont 3.5 % du prix net vendeur de 864 700euros. Pour plus de renseignements contacter localement votre conseiller immobilier indépendant Véronique Da Costa de l'agence Propriétés Privées au Voir le téléphone en précisant la réf 244191VDC - Mandat N° 244191 - RCS 487 624 777 . Le professionnel vous conseille, garantit et sécurise votre projet immobilier. dont 3.50 % honoraires TTC à la charge de l'acquéreur.",895 000 €,300 m²,10 pièces,6 chambres,1 place de parking,,,,,2 882 €/m²,Réf. de l’annonce : 244191VDC,Publiée le 13 nov. 2020,Modifiée le 28 nov. 2020,"Achat maison 10 pièces 300 m², Rambouillet - 895 000 €",Descriptif de cette maison à vendre de 10 pièces et 300 m²
562,YV78_566,Carrières-sur-Seine 78420 (Fermettes - Amandiers - Colombier),"Maison 6p avec jardin 13' de la Gare. Maison de 149 m² sise sur une parcelle de 450m² offrant 4 chambres , un bureau et 42 m² de réceptions.
Elle se compose d'une partie érigée en 1930 qui a fait l'objet d'un agrandissement contemporain assez réussi.
Elle offre ainsi 42 m² de réceptions ( avec insert) de plain pied avec le jardin exposé SUD OUEST.
La cuisine aménagée, équipée mesure 9.80 m² et donne elle aussi sur la terrasse du jardin. Le rez de chaussée dispose d'une chambre (11.50m²) d'une salle de bains et d'un 1er wc indépendant. L 'étage de la partie ""moderne"" nous fait découvrir une mini suite parentale de 14.50 m² avec un coin douche et un coin toilettes assortie d'une terrasse sur jardin de 8m². La partie historique de l'étage dessert 2 chambres sous le faitage respectivement de 18.40 m² au sol ( 8.20 m²equiv. lCarrez) et 15m² au sol ( equiv. 8m² l.Carrez) ainsi qu'une salle de bains. Enfin l'entresol dessert une cave à vin , une chaufferie buanderie, une cave, ainsi qu'un bureau de 12.50m² avec accès au jardin ( porte fenêtre et fenêtre!). La maison n'est pas mitoyenne , dans une rue très calme à 13mn à pied de la gare de RER /sncf ST Lazare ( HOUILLES /CARR/SEINE) et 5 ' à pied du collège. Assurément idéale pour une famille .
contact Frédéric QUERLEU Voir le téléphone . RSAC VERSAILLES 510591647
Mentions légales :
Honoraires à la charge du vendeur",836 000 €,149 m²,6 pièces,4 chambres,1 place de parking,,,,,5 611 €/m²,Réf. de l’annonce : 748951009-419,Publiée le 13 nov. 2020,Modifiée le 3 déc. 2020,"Achat maison 6 pièces 149 m², Carrières-sur-Seine - 836 000 €",Descriptif de cette maison à vendre de 6 pièces et 149 m²
563,YV78_567,Gressey 78550,"Maison de 10 pièces. Quel luxe? Quelle fantaisie? Quel charme? Sur la commune de Gressey, proche écoles et à 5 minutes de la gare de Houdan et de l'axe N12. Maison individuelle comprenant : entrée, séjour double de 40m² avec cheminée, cuisine équipée, wc avec lave mains, dressing, 3 chambres (dont une refaite intégralement avec isolation intérieure). A l'étage : palier, mezzanine de 25m², espace aménagé en 2018 comprenant séjour avec kitchenette, chambre et salle d'eau avec wc de 53m². Sous sol total aménagé en palier, salle d'eau avec wc, séjour avec cuisine ouverte de 26m², 2 chambres, garage double, pièce de rangement sous terrasse (isolation refaite). Terrain clos sans vis à vis de 1238m² avec terrasse couverte avec cuisine d'été donnant sur une piscine chauffée. Belles prestations d'ensemble! Une affaire de haute qualité.",452 700 €,266 m²,10 pièces,6 chambres,,Jardin,,,,1 702 €/m²,Réf. de l’annonce : 661_2,Publiée le 10 nov. 2020,Modifiée le 5 déc. 2020,"Achat maison 10 pièces 266 m², Gressey - 452 700 €",Descriptif de cette maison à vendre de 10 pièces et 266 m²
564,YV78_568,Saint-Cyr-l'École 78210 (Gérard Philippe),"MAISON INDIVIDUELLE A 15 MN DE LA GARE. A VENDRE MAISON INDIVIDUELLE D'ENVIRON 90 M2 A 15 MN DE LA GARE SANS MITTOYENNETE COMPRENANT: ENTREE,DOUBLE-SEJOUR ,TROIS CHAMBRES,COMBLES AMENAGEABLES,CUISINE INDEPENDANTE,W.C,SALLE D'EAU.. TERRASSE ET SOUS-SOL + GARAGE INDEPENDANT.. A RENOVER !",420 000 €,90 m²,6 pièces,3 chambres,2 places de parking,Jardin,,,,4 444 €/m²,Réf. de l’annonce : 007052E1RE0T,Publiée le 10 nov. 2020,Modifiée le 25 nov. 2020,"Achat maison 6 pièces 90 m², Saint-Cyr-l'École - 420 000 €",Descriptif de cette maison à vendre de 6 pièces et 90 m²
565,YV78_569,Les Mureaux 78130 (Nouvelle France),"Charmante maison 5 pièces Quartier de LA HAYE. A vendre aux Mureaux, sur le magnifique quartier de LA HAYE, proche bords de seine, centre ville, gare; Charmante maison d'environ 80m² habitable (108m² au sol), comprenant Une belle pièce à vivre lumineuse avec cuisine aménagée et équipée, 3 chambres (dont une de 14m²), grande salle de bains + douche, wc. Combles aménagés (salle de jeux/bureau...). Cave aménagée en buanderie, bureau, rangements. Chauffage gaz de ville (4ans), de belles prestations pour cette maison implantée sur un terrain clos et sans vis à vis de 183m². IDEAL PREMIER ACHAT !! Contactez votre Négociateur Mr JEGOU Quentin Voir le téléphone - n° RSAC 852 321 694
Mentions légales :
Honoraires à la charge du vendeur",262 500 €,80 m²,5 pièces,3 chambres,,,,,,3 281 €/m²,Réf. de l’annonce : 749381002-61,Publiée le 9 nov. 2020,Modifiée le 17 nov. 2020,"Achat maison 5 pièces 80 m², Les Mureaux - 262 500 €",Descriptif de cette maison à vendre de 5 pièces et 80 m²
566,YV78_570,Les Essarts-le-Roi 78690,"LES ESSARTS LE ROI 78690 ** Maison 4 pièces avec jardin **. //RARE A LA VENTE// IDÉAL PREMIÈRE ACQUISITION ! Entre l'appartement et la maison ! À deux pas de la gare SNCF et à proximité immédiate du Centre-ville des ESSARTS LE ROI et de toutes ses commodités A PIEDS, David et Kim de BLB Immobilier, ont le plaisir de vous présenter, cette CHARMANTE Maison mitoyenne des 2 côtés de 68,07 m2 habitables, édifiée en 1970, sur un jardin clos de 64,63 m2. Venez découvrir au Rez-de-chaussée : un AGRÉABLE espace de vie LUMINEUX d'environ 32,68 m2 avec cuisine US équipée et aménagée récente (TOUJOURS SOUS GARANTIE DÉCENNALE), un coin buanderie avec des rangements, ainsi qu'un WC indépendant.
Au 1er étage, un Palier dessert 2 BELLES Chambres dont 1 avec un dressing (12,94 m2/11,02 m2), une Salle de Bain de 4,45 m2 et un WC Indépendant.
Une terrasse, vous permettra de passer d'agréable moment en Famille ou entre amis dans le jardin !
Une place de parking extérieur, accompagne ce bien. *** LES PLUS *** : Double vitrage PVC, Électricité refaite, Jardin sans vis-à-vis, Toutes commodités à pieds (gare, centre ville, commerces, écoles, collège et piscine). Vous l'aurez compris, Venez découvrir cette Maison où il ne manque plus que vos valises, une visite ensemble s'impose... La présente annonce immobilière vise 3 lots situés dans une copropriété formant 12 lots au total ne faisant l'objet d'aucune procédure en cours et d'un montant de charges d'environ 129,30 euros par mois (soit 1 551,06 euros annuels)
***VISITE VIRTUELLE DISPONIBLE SUR NOTRE SITE INTERNET***
Contacter votre DUO Essartois : Kim et David, vos Consultants en Immobilier des Essarts-le-Roi/Lévis Saint Nom. Disponible pour VOUS 7J/7 au 06.76.08.50.55/06.74.63.97.71. La présente annonce immobilière a été rédigée sous la responsabilité éditoriale de Mme LE CORRE Kim, RSAC VERSAILLES no 795069665",258 750 €,"68,06 m²",4 pièces,2 chambres,1 place de parking,,,1 terrasse,,3 673 €/m²,Réf. de l’annonce : B468,Publiée le 9 nov. 2020,Modifiée le 7 déc. 2020,"Achat maison 4 pièces 68 m², Les Essarts-le-Roi - 258 750 €",Descriptif de cette maison à vendre de 4 pièces et 68 m²
567,YV78_571,Villepreux 78450,"Maison Villepreux 5 pièce(s) 89 m2. Superbe maison individuelle et moderne de 2015 (Basse consommation) dans un quartier familial et très recherché comprenant: entrée, séjour, salle à manger, cuisine ouverte équipée, 3 chambres avec placards dont une donnant sur un balcon, une grande salle d'eau, 2 WC, un beau jardin clos avec terrasse et un garage attenant avec 2 places de parking extérieures. Ses atouts: très bel aspect extérieur, moderne avec toiture terrasse et panneaux photovoltaïques, environnement de qualité, lumineux, aucun travaux à prévoir, stores électriques centralisées, porte de garage motorisée... Tout simplement le coup de coeur de l'agence.",450 000 €,"89,22 m²",5 pièces,3 chambres,1 place de parking,Jardin,,1 terrasse,,5 044 €/m²,,Publiée le 9 nov. 2020,Réf. de l’annonce : 3094,"Achat maison 5 pièces 89 m², Villepreux - 450 000 €",Descriptif de cette maison à vendre de 5 pièces et 89 m²
568,YV78_572,Mézières-sur-Seine 78970,"Maison neuve en L SHON 220 m² élevée sur sous-sol total en cours de construction!. Proposition particulière :
Sur les hauteurs de Mézières sur Seine, ce projet dont le permis de construire est accepté
et les travaux au stade de la dalle de rez de chaussée est une opportunité rare de finaliser votre projet de construction en quelques mois!
Le permis a fait l'objet d'une modification pour créer 2 maisons d'habitations en vue d'un investissement locatif. (permis modificatif possible)
Le sous-sol et l'avancement actuel permettent d'adapter le projet à vos envies personnelles dans une surface de 200 m² de SHON!
Les fondations sont renforcées selon les préconisation du bureau d'étude.
Plus d'information : appeler Jean-Baptiste Voir le téléphone dont 6.08 % honoraires TTC à la charge de l'acquéreur.",259 900 €,190 m²,8 pièces,4 chambres,,Jardin,,,,1 289 €/m²,,Publiée il y a plus de 2 mois,Réf. de l’annonce : 6304,"Achat maison 8 pièces 190 m², Mézières-sur-Seine - 259 900 €",Descriptif de cette maison à vendre de 8 pièces et 190 m²
569,YV78_573,Poissy 78300 (La Coudraie),"Maison Poissy 4 pièce(s). Orpi vous propose en exclusivité cette maison de 2018 avec terrasse + jardin.. . Elle comprend une entrée, une chambre de plain pied, une salle d'eau avec wc ; un salon/séjour donnant sur une terrasse et une cuisine de belle qualité entièrement aménagée et équipée. . . A l'étage, un palier desservant une salle de bains et deux grandes chambres dont une donnant sur une grande terrasse.. . 2 places de parking en sous-sol viennent compléter ce bien.",345 000 €,83 m²,4 pièces,3 chambres,2 places de parking,Jardin,,,,3 978 €/m²,Réf. de l’annonce : 007915E1OM5C,Publiée il y a plus de 2 mois,Modifiée le 4 déc. 2020,"Achat maison 4 pièces 83 m², Poissy - 345 000 €",Descriptif de cette maison à vendre de 4 pièces et 83 m²
570,YV78_574,Les Clayes-sous-Bois 78340 (Ouest),"Maison 4 pièces. Située dans un quartier pavillonnaire paisible et familiale, proche des écoles et des commerces, belle maison de 4 pièces offrant au Rdc : une entrée avec rangement, un séjour donnant sur le jardin, une cuisine aménagée et équipée avec un accès garage. et un WC séparés. A l'étage : un palier desservant 3 chambres et une salle de bains avec WC. Combles aménageable. Un garage attenant et la jouissance d'une place de parking. Le tout édifié sur un terrain sans vis-à-vis de 236m². dont 5.34 % honoraires TTC à la charge de l'acquéreur.",355 000 €,80 m²,4 pièces,3 chambres,2 places de parking,Jardin,,,,4 213 €/m²,Réf. de l’annonce : 4161,Publiée le 8 nov. 2020,Modifiée le 4 déc. 2020,"Achat maison 4 pièces 80 m², Les Clayes-sous-Bois - 355 000 €",Descriptif de cette maison à vendre de 4 pièces et 80 m²
571,YV78_575,Saint-Germain-en-Laye 78100 (Pontel - Schnapper - Sous-préfecture),"VISITE 3d IMMERSIVE DE CE BIEN DISPONIBLE EN APPELANT L' AGENCE - Voir le téléphone - 

NOUVEAU - Legs & Patrimoine Ouest IMMOBILIER vous propose, à SAINT GERMAIN en LAYE, à seulement 5' en voiture/bus de la Place Royale, dans un environnement privilégié, protégé et extrêmement résidentiel, cette superbe maison édifiée sur une parcelle de 1 000 m2, parcelle entièrement close.

Au calme absolu, cette jolie maison édifiée en 1985 est en parfait état et ne nécessite aucun travaux. Elle se développe sur 2 niveaux (hors sous-sol total) et dispose d'une superficie habitable de plus de 260 m2. 
Le rez de chaussée se compose d'une vaste pièce de vie très chaleureuse ouvrant sur terrasse et jardin paysagé, une cuisine entièrement équipée. Egalement une chambre et un bureau.
Les prestations offertes, la qualité de fabrication et les matériaux sont de grandes qualités.
A l'étage, 4 grandes chambres, une salle de bains et une salle d'eau.
Produit excessivement rare à visiter très rapidement.

Plus de renseignements en agence (diagnostics, détails des travaux réalisés (...)).",1 260 000 €,266 m²,9 pièces,5 chambres,,Jardin de 850 m²,,2 terrasses,2 garages,4 737 €/m²,Réf. de l’annonce : 33065129,Publiée le 7 nov. 2020,Modifiée le 4 déc. 2020,"Achat maison 9 pièces 266 m², Saint-Germain-en-Laye - 1 260 000 €",Descriptif de cette maison à vendre de 9 pièces et 266 m²
572,YV78_576,Chatou 78400 (Nord),"Maison 160 m² avec Jardin. Belle opportunité à finaliser selon vos goûts !
Nous vous proposons cette maison de 160 m² au potentiel très intéressant, posée sur une parcelle de 235 m² et proche de toutes commodités (à deux pas des commerces et écoles + transports).
L'achèvement des travaux (isolation des combles, peintures, électricité, ravalement extérieur et finition, chaudière et radiateurs, faux plafonds et cloisons, salle de bains et carrelage, rembardes et garde corps...) seront à la charge des futurs acquéreurs (109 820 € H.T. - devis à l'appui) et permettra ainsi de l'aménager à sa convenance.
Les fenêtres et velux sont déjà installées !
Au rdc : un plateau de 60 m² pouvant accueillir un vaste séjour et sa cuisine + wc séparé.
Au 1er étage : un second plateau de 60 m² où nous pouvons imaginer une suite parentale et sa salle d'eau, deux autres chambres, une salle de bain + wc et dressing.
Enfin un sous-sol de 40 m² (semi-enterré), accessible par l'intérieur ou par le jardin, pourra aisément accueillir une nouvelle chambre, une salle de jeux ou une dépendance.
Le terrain est clôturé, pourra bénéficier d'une terrasse et n'attend que vous pour s'exprimer pleinement !
Pour plus d'informations, n'hésitez pas à me contacter au Voir le téléphone - Emmanuel AZÉMARD
Mentions légales :
Prix 460000 euros honoraires exclus
Honoraires de 19000 TTC à la charge de l'acquéreur",479 000 €,160 m²,5 pièces,4 chambres,,Jardin,,Terrasse,,2 879 €/m²,Réf. de l’annonce : 748951005-327,Publiée le 6 nov. 2020,Modifiée le 19 nov. 2020,"Achat maison 5 pièces 160 m², Chatou - 479 000 €",Descriptif de cette maison à vendre de 5 pièces et 160 m²
573,YV78_577,Trappes 78190 (La Boissière),"TRAPPES La Boissière - Maison 5 pièce(s) 113 m2. ORPI WELL'k'HOME vous présente cette grande maison de 113m2 édifiée sur terrain de 340m2, exposée Est-Ouest.. Au rez-de-chaussée vous découvrirez une cuisine dinatoire, équipée aménagée de 12m2, une belle pièce à vivre avec cheminée ouvrant sur un beau jardin bien exposé, une salle de douche avec WC, et un garage de 25m2 pouvant accueillir deux voitures.. A l'étage, 4 chambres, une salle de bain, un WC séparé, un cellier et une grande buanderie de 10 m2.. L'isolation extérieure et le ravalement de la maison ont été fait récemment (2018/2019). Toutes les fenêtres double vitrage et tous les volets roulants en PVC ont été changés en 2018/2019 également.. Les combles , accessibles par le cellier, sont isolés et peuvent être aménagés.. . Venez apprécier, les volumes, le calme et le potentiel de cette maison.. Maison avec un beau potentiel, à visiter sans tarder !",339 900 €,113 m²,5 pièces,4 chambres,4 places de parking,Jardin,,,,2 876 €/m²,Réf. de l’annonce : 007083E1R84E,Publiée le 6 nov. 2020,Modifiée le 6 nov. 2020,"Achat maison 5 pièces 113 m², Trappes - 339 900 €",Descriptif de cette maison à vendre de 5 pièces et 113 m²
574,YV78_578,Chambourcy 78240,"Maison. Centre du Village, maison ancienne de 171 m² avec de très beaux volumes. Elle se compose d'une entrée, cuisine équipée, salon de 46 m², 3 chambres, 1 mezzanine ou chambre de 21 m², salle de bains, wc, cave, cour, garage 2 voitures. Accès A14 et A13. 5 mn Lycée International.-
Cimm Immobilier POISSY - Voir le téléphone - Honoraires charge vendeur Agent Commercial CIMM IMMOBILIER - SAS JCM - Cimm Immobilier POISSY - Chantal COSPEREC - Voir le téléphone - Agent Commercial - RSAC N° 433 202 017 - Ville du greffe : VERSAILLES - Plus d'informations sur (lien supprimé) (réf. 10291) - - DPE : D",616 000 €,146 m²,7 pièces,4 chambres,1 place de parking,,,,,4 219 €/m²,Réf. de l’annonce : 380045317,Publiée le 5 nov. 2020,Modifiée le 27 nov. 2020,"Achat maison 7 pièces 146 m², Chambourcy - 616 000 €",Descriptif de cette maison à vendre de 7 pièces et 146 m²
575,YV78_579,Les Mureaux 78130 (Route de Verneuil - Aérodrome),"Magnifique maison secteur des Perrons proche GARE. A vendre, proche Gare et centre ville des Mureaux, secteur calme et recherché des Perrons, magnifique maison entièrement rénovée, d'environ 110 m², comprenant: Au Rez de chaussée, Entrée, buanderie avec point d'eau, cuisine meublée et équipée avec coin repas, salon avec poêle à bois, wc. A l'étage: 3 chambres (possible 4), espace bureau, salle de bains, wc. Accès grenier pour rangement. Cave totale. Terrain clos de 1000 m² !! VOUS SEREZ CHARME !!!
Votre négociateur Immobilier Mr JEGOU Quentin Voir le téléphone - n°RSAC 852 321 694
Mentions légales :
Honoraires à la charge du vendeur",399 000 €,107 m²,6 pièces,3 chambres,5 places de parking,Jardin,,Terrasse,,3 729 €/m²,Réf. de l’annonce : 749381002-60,Publiée le 5 nov. 2020,Modifiée le 6 nov. 2020,"Achat maison 6 pièces 107 m², Les Mureaux - 399 000 €",Descriptif de cette maison à vendre de 6 pièces et 107 m²
576,YV78_580,Médan 78670,"MEDAN-EXCLUSIVITE. L'AGENCE DE VILLENNES vous propose en exclusivité à MEDAN, joli village historique d'Emile ZOLA, près de VILLENNES SUR SEINE, à pied de la Mairie, des écoles et de son commerce, une jolie petite maison ancienne composée d'une entrée, salon avec poêle, cuisine aménagée et salle à manger,autre salon, salle d'eau avec toilette. A l'étage: grand palier pouvant servir de couchage, 1 chambre, rangement. En rez de jardin: cave et garage. Beau terrain clos de 400m2 et terrasse. Proche gare SNCF de VILLENNES (futur RER E), accès rapide A13/A14. Idéal première acquisition ou investisseurs. VISITE VIRTUELLE EN LIGNE.",350 000 €,54 m²,5 pièces,2 chambres,,Jardin,,,,6 173 €/m²,Réf. de l’annonce : 5096,Publiée le 4 nov. 2020,Modifiée le 25 nov. 2020,"Achat maison 5 pièces 54 m², Médan - 350 000 €",Descriptif de cette maison à vendre de 5 pièces et 54 m²
